{
  "bundleId": "exampleco-stale-bundle-2026-03-24",
  "generatedAt": "2026-03-24T05:20:00Z",
  "verifierVersion": "opencompliance-verifier/0.9.5",
  "organisation": "ExampleCo",
  "profileId": "stale_freshness_corridor",
  "frameworkIntent": [
    "ISO 27001",
    "SOC 2"
  ],
  "scope": {
    "inScope": [
      "Identity provider MFA enforcement",
      "Cloud audit logging",
      "Security awareness training records",
      "Restore exercise attestations"
    ],
    "outOfScope": [
      "Whole-program policy adequacy",
      "Full disaster recovery program effectiveness",
      "Clause-complete framework certification"
    ],
    "note": "Synthetic public-safe ExampleCo proof bundle with freshness blockers in an otherwise narrow corridor."
  },
  "claims": [
    {
      "claimId": "EX-CLAIM-401",
      "title": "Administrative identities require MFA in the scoped production environment.",
      "result": "proved",
      "frameworkMappings": [
        {
          "framework": "SOC 2",
          "family": "access_control",
          "controlId": "soc2.family.access_control"
        },
        {
          "framework": "ISO 27001",
          "family": "identity_and_access_management",
          "controlId": "iso27001.family.identity_and_access_management"
        }
      ],
      "controlRefs": [
        "oc.id-01"
      ],
      "evidenceRefs": [
        "EV-401"
      ],
      "basis": "The identity provider export states MFA is required and conditional access is enabled."
    },
    {
      "claimId": "EX-CLAIM-402",
      "title": "Audit logging is enabled for the scoped production stack.",
      "result": "stale_evidence",
      "frameworkMappings": [
        {
          "framework": "SOC 2",
          "family": "logging_monitoring",
          "controlId": "soc2.family.logging_monitoring"
        },
        {
          "framework": "ISO 27001",
          "family": "logging_and_monitoring",
          "controlId": "iso27001.family.logging_and_monitoring"
        }
      ],
      "controlRefs": [
        "oc.log-01"
      ],
      "evidenceRefs": [
        "EV-402"
      ],
      "basis": "The cloud logging export exists, but its freshness window expired before this verification run."
    },
    {
      "claimId": "EX-CLAIM-403",
      "title": "Security awareness training completion is documented for the current review window.",
      "result": "stale_evidence",
      "frameworkMappings": [
        {
          "framework": "ISO 27001",
          "family": "awareness_and_training",
          "controlId": "iso27001.family.awareness_and_training"
        }
      ],
      "controlRefs": [
        "oc.train-01"
      ],
      "evidenceRefs": [
        "EV-403"
      ],
      "basis": "The training attestation exists, but its freshness window expired before this verification run."
    },
    {
      "claimId": "EX-CLAIM-404",
      "title": "Restore testing has been performed in the declared review window.",
      "result": "attested",
      "frameworkMappings": [
        {
          "framework": "SOC 2",
          "family": "backup_and_recovery",
          "controlId": "soc2.family.backup_and_recovery"
        },
        {
          "framework": "ISO 27001",
          "family": "backup_and_recovery",
          "controlId": "iso27001.family.backup_and_recovery"
        }
      ],
      "controlRefs": [
        "oc.rec-01"
      ],
      "evidenceRefs": [
        "EV-404"
      ],
      "basis": "The restore exercise claim is documentary and signed by a named human actor."
    }
  ],
  "summary": {
    "proved": 1,
    "attested": 1,
    "failed": 0,
    "staleEvidence": 2,
    "judgmentRequired": 0,
    "evidenceMissing": 0
  },
  "nextActions": [
    "Refresh the expired cloud logging export before rerunning Verify.",
    "Renew the expired training attestation instead of silently treating it as current.",
    "Keep stale evidence distinct from failed predicates and missing evidence in downstream artifacts."
  ],
  "proofRunner": {
    "batchId": "exampleco-stale-bundle-2026-03-24-lean-batch",
    "fixture": "stale",
    "status": "verified",
    "theoremCount": 1,
    "verifiedTheorems": [
      "claim_EX_CLAIM_401_proved"
    ],
    "importedModules": [
      "OpenCompliance.Controls.Identity"
    ],
    "verifiedClaims": [
      {
        "claimId": "EX-CLAIM-401",
        "controlId": "oc.id-01",
        "module": "OpenCompliance.Controls.Identity",
        "predicate": "AdministrativeMfaSatisfied",
        "evidenceClaimType": "identity_mfa_enforcement",
        "theorem": "claim_EX_CLAIM_401_proved"
      }
    ],
    "typedBoundaryLayer": {
      "source": "LegalLean",
      "dependency": {
        "package": "legal-lean",
        "primaryImports": [
          "LegalLean.Core",
          "LegalLean.Defeasible",
          "LegalLean.Solver"
        ]
      },
      "typedModules": [
        {
          "module": "OpenCompliance.Controls.Typed.TypedIdentity",
          "covers": [
            "FormalisationBoundary.formal",
            "FormalisationBoundary.boundary",
            "RequiresHumanDetermination"
          ]
        },
        {
          "module": "OpenCompliance.Controls.Typed.TypedLogging",
          "covers": [
            "FormalisationBoundary.formal",
            "FormalisationBoundary.boundary",
            "narrow_audit_logging_runtime"
          ]
        },
        {
          "module": "OpenCompliance.Controls.Typed.RiskAcceptance",
          "covers": [
            "Defeats",
            "risk_acceptance_override"
          ]
        },
        {
          "module": "OpenCompliance.Controls.Typed.DiscretionaryTerms",
          "covers": [
            "Vague",
            "judgment_boundary_inventory"
          ]
        },
        {
          "module": "OpenCompliance.Controls.Typed.ComplianceSolver",
          "covers": [
            "LegalLean.Solver",
            "minimal_claim_corpus",
            "runtime_claim_decisions"
          ]
        },
        {
          "module": "OpenCompliance.Controls.Typed.PublicRuntime",
          "covers": [
            "formalDecision",
            "documentaryDecision",
            "judgmentDecision",
            "public_corridor_runtime_claim_decisions"
          ]
        }
      ],
      "runtimeConsumedClaims": [
        "EX-CLAIM-401",
        "EX-CLAIM-402",
        "EX-CLAIM-403",
        "EX-CLAIM-404"
      ],
      "runtimeStatus": {
        "typedControlResultsLive": true,
        "riskAcceptanceDefeasibilityLive": true,
        "discretionaryTermTypingLive": true,
        "fullMinimalSolverAgreement": false,
        "pythonVerdictLayerReplaced": true
      }
    },
    "boundaryInventory": {
      "provedClaimCount": 1,
      "leanBackedClaimCount": 1,
      "omittedProvedClaims": []
    },
    "command": [
      "lake",
      "env",
      "lean",
      "<generated-batch>"
    ]
  }
}
